{
  "$id": "https://decision-alpha-lab.local/schemas/saed-v4-24/model_risk_review.schema.json",
  "$schema": "https://json-schema.org/draft/2020-12/schema",
  "additionalProperties": false,
  "description": "Closed deterministic research-only contract. Unknown object fields are rejected.",
  "properties": {
    "accepted_reference_only": {
      "type": "boolean"
    },
    "open_external_evidence": {
      "items": {
        "type": "string"
      },
      "type": "array"
    },
    "phase": {
      "type": "string"
    },
    "review_hash": {
      "type": "string"
    },
    "risks": {
      "items": {
        "additionalProperties": false,
        "properties": {
          "control": {
            "type": "string"
          },
          "risk": {
            "type": "string"
          },
          "severity": {
            "type": "string"
          }
        },
        "required": [
          "control",
          "risk",
          "severity"
        ],
        "type": "object"
      },
      "type": "array"
    }
  },
  "required": [
    "accepted_reference_only",
    "open_external_evidence",
    "phase",
    "review_hash",
    "risks"
  ],
  "title": "SAED V4-24 MODEL_RISK_REVIEW",
  "type": "object",
  "x-authority": "research-only-nonproduction",
  "x-phase": "SAED_V4_24"
}
